"RecipeId",Name,AuthorId,AuthorName,CookTime,PrepTime,TotalTime,DatePublished,Description,Images,RecipeCategory,Keywords,RecipeIngredientQuantities,RecipeIngredientParts,AggregatedRating,ReviewCount,Calories,FatContent,SaturatedFatContent,CholesterolContent,SodiumContent,CarbohydrateContent,FiberContent,SugarContent,ProteinContent,RecipeServings,RecipeYield,RecipeInstructions
38,Low-Fat Berry Blue Frozen Dessert,1533,Dancer,PT24H,PT45M,PT24H45M,1999-08-09T21:46:00Z,Make and share this Low-Fat Berry Blue Frozen Dessert recipe from Food.com.,"c(""https://img.sndimg.com/food/image/upload/w_555,h_416,c_fit,fl_progressive,q_95/v1/img/recipes/38/YUeirxMLQaeE1h3v3qnM_229%20berry%20blue%20frzn%20dess.jpg"", ""https://img.sndimg.com/food/image/upload/w_555,h_416,c_fit,fl_progressive,q_95/v1/img/recipes/38/AFPDDHATWzQ0b1CDpDAT_255%20berry%20blue%20frzn%20dess.jpg"", ""https://img.sndimg.com/food/image/upload/w_555,h_416,c_fit,fl_progressive,q_95/v1/img/recipes/38/UYgf9nwMT2SGGJCuzILO_228%20berry%20blue%20frzn%20dess.jpg"", ""https://img.sndimg.com/food/image/upload/w_555,h_416,c_fit,fl_progressive,q_95/v1/img/recipes/38/PeBMJN2TGSaYks2759BA_20140722_202142.jpg"", ",Frozen Desserts,"c(""Dessert"", ""Low Protein"", ""Low Cholesterol"", ""Healthy"", ""Free Of..."", ""Summer"", ""Weeknight"", ""Freezer"", ""Easy"")","c(""4"", ""1/4"", ""1"", ""1"")","c(""blueberries"", ""granulated sugar"", ""vanilla yogurt"", ""lemon juice"")",4.5,4,170.9,2.5,1.3,8,29.8,37.1,3.6,30.2,3.2,4,NA,"c(""Toss 2 cups berries with sugar."", ""Let stand for 45 minutes, stirring occasionally."", ""Transfer berry-sugar mixture to food processor."", ""Add yogurt and process until smooth."", ""Strain through fine sieve. Pour into baking pan (or transfer to ice cream maker and process according to manufacturers' directions). Freeze uncovered until edges are solid but centre is soft.  Transfer to processor and blend until smooth again."", ""Return to pan and freeze until edges are solid."", ""Transfer to processor and blend until smooth again."", "
39,Biryani,1567,elly9812,PT25M,PT4H,PT4H25M,1999-08-29T13:12:00Z,Make and share this Biryani recipe from Food.com.,"c(""https://img.sndimg.com/food/image/upload/w_555,h_416,c_fit,fl_progressive,q_95/v1/img/recipes/39/picM9Mhnw.jpg"", ""https://img.sndimg.com/food/image/upload/w_555,h_416,c_fit,fl_progressive,q_95/v1/img/recipes/39/picHv4Ocr.jpg"")",Chicken Breast,"c(""Chicken Thigh & Leg"", ""Chicken"", ""Poultry"", ""Meat"", ""Asian"", ""Indian"", ""Weeknight"", ""Stove Top"")","c(""1"", ""4"", ""2"", ""2"", ""8"", ""1/4"", ""8"", ""1/2"", ""1"", ""1"", ""1/4"", ""1/4"", ""1/2"", ""1/4"", ""2"", ""3"", NA, ""2"", ""1"", ""1"", ""8"", ""2"", ""1/3"", ""1/3"", ""1/3"", ""6"")","c(""saffron"", ""milk"", ""hot green chili peppers"", ""onions"", ""garlic"", ""clove"", ""peppercorns"", ""cardamom seed"", ""cumin seed"", ""poppy seed"", ""mace"", ""cilantro"", ""mint leaf"", ""fresh lemon juice"", ""plain yogurt"", ""boneless chicken"", ""salt"", ""ghee"", ""onion"", ""tomatoes"", ""basmati rice"", ""long-grain rice"", ""raisins"", ""cashews"", ""eggs"")",3,1,1110.7,58.8,16.6,372.8,368.4,84.4,9,20.4,63.4,6,NA,"c(""Soak saffron in warm milk for 5 minutes and puree in blender."", ""Add chiles, onions, ginger, garlic, cloves, peppercorns, cardamom seeds, cinnamon, coriander and cumin seeds, poppy seeds, nutmeg, mace, cilantro or mint leaves and lemon juice. Blend into smooth paste. Put paste into large bowl, add yogurt and mix well."", ""Marinate chicken in yogurt mixture with salt, covered for at least 2 - 6 hours in refrigerator."", ""In skillet. heat oil over medium heat for 1 minute. Add ghee and 15 seconds later add onion and fry for about8 minutes."", "
40,Best Lemonade,1566,Stephen Little,PT5M,PT30M,PT35M,1999-09-05T19:52:00Z,"This is from one of my  first Good House Keeping cookbooks.  You must use a *zester* in order to avoid getting any of that bitter rind, and when you zest the lemons, zest them onto some sugar from the recipe (the sugar will 'catch' all of the oils).  I also advise you from personal experience to use only the best skinned lemons for the best flavor.","c(""https://img.sndimg.com/food/image/upload/w_555,h_416,c_fit,fl_progressive,q_95/v1/img/recipes/40/picJ4Sz3N.jpg"", ""https://img.sndimg.com/food/image/upload/w_555,h_416,c_fit,fl_progressive,q_95/v1/img/recipes/40/pic23FWio.jpg"")",Beverages,"c(""Low Protein"", ""Low Cholesterol"", ""Healthy"", ""Summer"", ""< 60 Mins"")","c(""1 1/2"", ""1"", NA, ""1 1/2"", NA, ""3/4"")","c(""sugar"", ""lemons, rind of"", ""lemon, zest of"", ""fresh water"", ""fresh lemon juice"")",4.5,10,311.1,0.2,0,0,1.8,81.5,0.4,77.2,0.3,4,NA,"c(""Into a 1 quart Jar with tight fitting lid, put sugar and lemon peel, or zest;  add 1 1/2 cups very hot water (not from tap!). With lid fitted firmly, shake jar until sugar is dissolved."", ""Add lemon juice. Refrigerate until chilled."", ""To Serve: Into each 12-ounce glass, over ice cubes, pour 1/4 cup of the lemon syrup."", ""Then add chilled club soda or, if you prefer, water."", ""Stir to mix well."")"
41,Carina's Tofu-Vegetable Kebabs,1586,Cyclopz,PT20M,PT24H,PT24H20M,1999-09-03T14:54:00Z,This dish is best prepared a day in advance to allow the ingredients to soak in  the marinade overnight.,"c(""https://img.sndimg.com/food/image/upload/w_555,h_416,c_fit,fl_progressive,q_95/v1/img/recipes/41/picmbLig8.jpg"", ""https://img.sndimg.com/food/image/upload/w_555,h_416,c_fit,fl_progressive,q_95/v1/img/recipes/41/picL02w0s.jpg"")",Soy/Tofu,"c(""Beans"", ""Vegetable"", ""Low Cholesterol"", ""Weeknight"", ""Broil/Grill"", ""Oven"")","c(""12"", ""1"", ""2"", ""1"", ""10"", ""1"", ""3"", ""2"", ""2"", ""2"", ""1"", ""2"", ""1/2"", ""1/4"", ""4"")","c(""extra firm tofu"", ""eggplant"", ""zucchini"", ""mushrooms"", ""soy sauce"", ""low sodium soy sauce"", ""olive oil"", ""maple syrup"", ""honey"", ""red wine vinegar"", ""lemon juice"", ""garlic cloves"", ""mustard powder"", ""black pepper"")",4.5,2,536.1,24,3.8,0,1558.6,64.2,17.3,32.1,29.3,2,4 kebabs,"c(""Drain the tofu, carefully squeezing out excess water,  and pat dry with paper towels."", ""Cut tofu into one-inch squares."", ""Set aside.  Cut  eggplant lengthwise in half, then cut each half into approximately three strips."", ""Cut strips crosswise into one-inch cubes."", ""Slice zucchini into half-inch thick  slices."", ""Cut red pepper in half, removing stem and seeds, and cut each half into  one-inch squares."", ""Wipe mushrooms clean with a moist paper towel and remove  stems."", ""Thread tofu and vegetables on to barbecue skewers in alternating color  combinations: For example, first a piece of eggplant, then a slice of tofu, then zucchini, then red pepper, baby corn and mushrooms."", "
42,Cabbage Soup,1538,Duckie067,PT30M,PT20M,PT50M,1999-09-19T06:19:00Z,Make and share this Cabbage Soup recipe from Food.com.,"""https://img.sndimg.com/food/image/upload/w_555,h_416,c_fit,fl_progressive,q_95/v1/img/recipes/42/picVEMxk8.jpg""",Vegetable,"c(""Low Protein"", ""Vegan"", ""Low Cholesterol"", ""Healthy"", ""Winter"", ""< 60 Mins"", ""Easy"")","c(""46"", ""4"", ""1"", ""2"", ""1"")","c(""plain tomato juice"", ""cabbage"", ""onion"", ""carrots"", ""celery"")",4.5,11,103.6,0.4,0.1,0,959.3,25.1,4.8,17.7,4.3,4,NA,"c(""Mix everything together and bring to a boil."", ""Reduce heat and simmer for 30 minutes (longer if you prefer your veggies to be soft)."", ""Refrigerate until cool."", ""Serve chilled with sour cream."")"